{
  "contract": "bizcity_roadmap@1",
  "updated": "2026-10-30",
  "note": "Bản máy đọc của PHASES.md. Mỗi việc 'xong' khi MỌI tín hiệu trong 'done' đúng; một phần đúng = đang làm. Việc tay chỉ tính xong khi ghi doneAt + by. Sửa PHASES.md thì sửa tệp này trong cùng PR (SC-RMP-1 so hai bên).",
  "areas": {
    "kernel": "Kernel sổ cái",
    "data": "Data",
    "document": "Document",
    "action": "Action",
    "event": "Event",
    "evidence": "Evidence",
    "module": "Module / Extension",
    "mcp-cell": "MCP · Cell",
    "template": "Gói định khoản",
    "security": "Bảo mật",
    "release": "Phát hành",
    "diagnostics": "Tự chẩn đoán",
    "quality": "Chất lượng · bộ kiểm"
  },
  "phases": [
    { "id": "0", "title": "Chốt chuẩn", "output": "docs/ chuẩn, CI, bộ kiểm", "estimate": "đang làm" },
    { "id": "1", "title": "Audit, phân loại generic / domain", "output": "Bản đồ tái sử dụng", "estimate": "1 tuần" },
    { "id": "2", "title": "Trích xuất Kernel, Data, Document, Action", "output": "Core chạy độc lập", "estimate": "6–8 tuần" },
    { "id": "3", "title": "Module SDK, manifest, permission, event", "output": "Kế toán chạy dưới dạng module", "estimate": "6–8 tuần" },
    { "id": "4", "title": "AGENTS.md, CLI, starter template, bộ kiểm", "output": "Claude tạo được module mới (ca chuẩn đạt)", "estimate": "3–4 tuần" },
    { "id": "5", "title": "Kiểm chứng CRM / kho, Cell, WordPress adapter", "output": "Beta cho developer", "estimate": "6–10 tuần" }
  ],
  "items": [
    { "id": "0.1", "phase": "0", "title": "Nhóm Lõi duyệt docs/standard, 7 hợp đồng, CANON", "areas": ["quality"],
      "done": [{ "manual": "PR tài liệu chuẩn được merge vào main" }] },
    { "id": "0.2", "phase": "0", "title": "Bật CI", "areas": ["quality"],
      "done": [{ "file": ".github/workflows/ci.yml" }, { "file": ".github/workflows/conformance.yml" }, { "manual": "CI xanh trên main (badge)" }] },
    { "id": "0.3", "phase": "0", "title": "Migration đúng chuẩn: hết trùng số 0028 (A-03), không thiếu migration so với db/types.ts", "areas": ["data"],
      "done": [{ "noFinding": { "check": "SC-DATA-1", "key": "dup:0028" } }, { "check": "SC-DATA-7" }] },
    { "id": "0.4", "phase": "0", "title": "Chốt 3 câu hỏi REUSE-MAP §6 bằng ADR", "areas": ["kernel", "module"],
      "done": [{ "file": "docs/adr/ADR-0003-hop-dong-thanh-module.md" }, { "file": "docs/adr/ADR-0004-ban-hang-tach-doi.md" }, { "file": "docs/adr/ADR-0005-danh-muc-chuan-o-packages-data.md" }] },
    { "id": "0.5", "phase": "0", "title": "Bộ kiểm chuẩn một chỗ tests/conformance", "areas": ["quality", "diagnostics"],
      "done": [{ "file": "tests/conformance/selfcheck.mjs" }, { "file": "tests/conformance/fixtures/expect.json" }, { "file": "tests/conformance/baseline.json" }] },
    { "id": "0.6", "phase": "0", "title": "Luật R-KER, R-SEC, R-REL, R-DIAG; SECURITY.md, CHANGELOG.md", "areas": ["security", "release", "kernel", "diagnostics"],
      "done": [{ "check": "SC-SEC-3" }, { "check": "SC-REL-1" }, { "file": "docs/rules/RULE-KERNEL.md" }, { "manual": "Bật GitHub Private Vulnerability Reporting" }] },
    { "id": "0.7", "phase": "0", "title": "API dùng vai trò CSDL không superuser; header bảo mật web", "areas": ["security"],
      "done": [{ "check": "DG-SEC-1" }, { "fileContains": { "file": "docker/nginx.conf", "text": "X-Content-Type-Options" } }, { "manual": "Bản cài thật đặt DB_APP_USER=ketoan_app + DB_APP_PASSWORD; DG-SEC-2 đạt khi chạy bằng tài khoản của API" }] },

    { "id": "1.1", "phase": "1", "title": "Rà REUSE-MAP với người phụ trách từng phân hệ", "areas": ["module"],
      "done": [{ "manual": "Mỗi dòng REUSE-MAP có người xác nhận" }] },
    { "id": "1.2", "phase": "1", "title": "Gắn nhãn @bizcity-layer cho mọi tệp apps/api/src", "areas": ["module", "kernel"],
      "done": [{ "label": "100% tệp có nhãn khớp bảng lớp (scripts/gan-nhan-lop.mjs)", "check": "SC-LAYER-1" }] },
    { "id": "1.3", "phase": "1", "title": "A-17..A-26 thành việc có người nhận", "areas": ["module"],
      "done": [{ "manual": "Danh sách việc có người nhận" }] },
    { "id": "1.4", "phase": "1", "title": "Đồ thị phụ thuộc hiện tại làm mốc", "areas": ["module"],
      "done": [{ "glob": "^docs/audits/deps-.*\\.svg$" }] },
    { "id": "1.5", "phase": "1", "title": "Bản nháp API @bizcity/module-sdk từ import thực tế", "areas": ["module"],
      "done": [{ "file": "packages/module-sdk/API.md" }] },

    { "id": "2.1", "phase": "2", "title": "eventStore.commit(): một cửa ghi sổ cho vouchers, closing, assets, costing (A-01)", "areas": ["kernel"],
      "done": [{ "check": "SC-KERNEL-3" }, { "check": "DG-EVENT-4" }] },
    { "id": "2.2", "phase": "2", "title": "assertLedgerInvariants() ở afterAll mọi tệp test", "areas": ["kernel", "quality"],
      "done": [{ "fileContains": { "file": "apps/api/test/helpers.ts", "text": "assertLedgerInvariants" } }] },
    { "id": "2.3", "phase": "2", "title": "Workspace packages/kernel + public.ts", "areas": ["kernel"], "after": ["2.1"],
      "done": [{ "file": "packages/kernel/package.json" }] },
    { "id": "2.4", "phase": "2", "title": "packages/data: ctx.data.tx, migration theo module, bizcity_read, RLS", "areas": ["data", "security"],
      "done": [{ "capability": "data.tenant-tx" }, { "capability": "data.read-views" }, { "readiness": { "check": "SC-DATA-6", "min": 100 } }] },
    { "id": "2.5", "phase": "2", "title": "packages/actions: defineAction, idempotency, dry-run", "areas": ["action"],
      "done": [{ "capability": "actions.runtime" }, { "capability": "actions.idempotency" }, { "capability": "actions.dry-run" }] },
    { "id": "2.6", "phase": "2", "title": "packages/audit: bằng chứng chỉ thêm, chuỗi băm, biên nhận", "areas": ["evidence", "security"],
      "done": [{ "capability": "evidence.receipt" }, { "readiness": { "check": "SC-EVD-2", "min": 100 } }] },
    { "id": "2.7", "phase": "2", "title": "packages/documents: số, phiên bản, liên kết, đính kèm chung", "areas": ["document"],
      "done": [{ "capability": "documents.numbering" }, { "capability": "documents.versions" }, { "capability": "documents.attachments" }] },
    { "id": "2.8", "phase": "2", "title": "Tách packages/contracts/src/mua-hang về phân hệ (A-06)", "areas": ["module"],
      "done": [{ "noFile": "packages/contracts/src/mua-hang" }] },
    { "id": "2.9", "phase": "2", "title": "GET /system/capabilities trả bảng năng lực thật", "areas": ["module", "release"],
      "done": [{ "fileContains": { "file": "apps/api/src/modules/system/system.routes.ts", "text": "/api/v1/system/capabilities" } }] },
    { "id": "2.10", "phase": "2", "title": "Tự chẩn đoán trong app: /system/diagnostics, /health/ready, version ở health", "areas": ["diagnostics", "release"],
      "done": [{ "label": "health trả version (R-REL-1)", "file": "apps/api/src/core/version.ts" },
               { "fileContains": { "file": "apps/api/src/modules/system/system.routes.ts", "text": "/api/v1/system/diagnostics" } },
               { "fileContains": { "file": "apps/api/src/modules/system/system.routes.ts", "text": "/api/v1/system/health/ready" } },
               { "label": "cùng mã kiểm với lane diagnostics (R-DIAG-9)", "check": "SC-DIAG-1" },
               { "label": "khoá kỳ bị chặn khi L3 có error (R-DIAG-4)", "fileContains": { "file": "apps/api/src/modules/periods/period.routes.ts", "text": "guardLock" } }] },
    { "id": "2.11", "phase": "2", "title": "platform/mcp đọc: POST /mcp, công cụ accounting.* (2b)", "areas": ["mcp-cell"],
      "done": [{ "capability": "mcp.read" }] },
    { "id": "2.12", "phase": "2", "title": "MCP sinh từ registry action, xác nhận needs_confirmation", "areas": ["mcp-cell", "action"], "after": ["2.5"],
      "done": [{ "capability": "mcp.tools" }] },
    { "id": "2.13", "phase": "2", "title": "Quan sát + mã lỗi chuẩn: request id, log, /metrics, bizcity_errors@1, bộ giám sát", "areas": ["diagnostics", "quality"],
      "done": [{ "check": "SC-ERR-1" }, { "fileContains": { "file": "apps/api/src/core/metrics.ts", "text": "bizcity_http_requests_total" } }, { "file": "infrastructure/monitoring/prometheus/alerts.yml" }] },
    { "id": "2.14", "phase": "2", "title": "Chính sách kế toán có phiên bản + ngày hiệu lực (G2-09, C-9)", "areas": ["kernel", "template"],
      "done": [{ "capability": "posting.policy-version" }, { "fileContains": { "file": "apps/api/src/db/types.ts", "text": "policy_version" } }] },
    { "id": "2.15", "phase": "2", "title": "Sao lưu PITR (WAL) + diễn tập khôi phục có biên bản (G1-08, G3-07, C-6)", "areas": ["data", "release"],
      "done": [{ "file": "infrastructure/backup/README.md" }, { "manual": "diễn tập PITR tới một thời điểm, đo RTO / RPO, biên bản ở docs/audits/" }] },
    { "id": "2.16", "phase": "2", "title": "MCP ghi: lập nháp, ghi sổ, đảo bút toán có xem trước + duyệt (G2-04)", "areas": ["mcp-cell", "action"], "after": ["2.1", "2.12"],
      "done": [{ "fileContains": { "file": "apps/api/test/mcp-write.test.ts", "text": "accounting.document.create_draft" } }, { "fileContains": { "file": "apps/api/test/mcp-write.test.ts", "text": "accounting.entry.reverse" } }] },

    { "id": "3.1", "phase": "3", "title": "@bizcity/module-sdk: defineModule, ctx", "areas": ["module"], "after": ["2.5", "2.6"],
      "done": [{ "file": "packages/module-sdk/package.json" }] },
    { "id": "3.2", "phase": "3", "title": "Manifest bizcity.module.json cho 9 phân hệ + 3 add-in", "areas": ["module"],
      "done": [{ "readiness": { "check": "SC-MOD-3", "min": 100 } }] },
    { "id": "3.3", "phase": "3", "title": "Registry quyền mở theo module", "areas": ["module", "security"],
      "done": [{ "capability": "permissions.module" }] },
    { "id": "3.4", "phase": "3", "title": "packages/events: outbox, subscriber, retry, replay, đồng hồ", "areas": ["event"],
      "done": [{ "capability": "events.outbox" }, { "capability": "events.subscribe" }, { "capability": "events.clock" }, { "check": "SC-EVT-1" }] },